{
  "benchmark_family": "contradiction-detection",
  "default_track": "contradiction-multihop",
  "governance_docs": [
    "docs/ADOPTION_GUIDE.md",
    "docs/ANNOUNCEMENT_PACKAGE.md",
    "docs/BENCHMARK_STANDARD.md",
    "docs/BENCHMARK_CARD.md",
    "docs/CHANGE_CONTROL.md",
    "docs/EXTERNAL_SUBMISSION_WALKTHROUGH.md",
    "docs/TECHNICAL_NOTE.md",
    "docs/GOVERNANCE.md",
    "docs/REVIEW_WORKFLOW.md",
    "docs/SUBMISSION_REVIEW_RUBRIC.md",
    "docs/THIRD_PARTY_EVIDENCE.md",
    "docs/STANDARDIZATION_STATUS.md",
    "docs/RELEASE_NOTES_v0_1_1.md",
    "docs/RELEASE_NOTES_v0_2_0.md",
    "docs/RELEASE_NOTES_v0_3_0.md",
    "docs/RELEASE_NOTES_v0_3_1.md",
    "docs/RELEASE_NOTES_v0_3_2.md",
    "docs/RELEASE_NOTES_v0_3_3.md",
    "docs/RELEASE_NOTES_v0_3_4.md",
    "docs/RELEASE_NOTES_v0_3_5.md",
    "docs/RELEASE_NOTES_v0_3_6.md",
    "docs/RELEASE_NOTES_v0_3_7.md",
    "docs/RELEASE_NOTES_v0_3_8.md",
    "docs/RELEASE_NOTES_v0_3_9.md",
    "docs/RELEASE_NOTES_v0_3_10.md",
    "docs/RELEASE_NOTES_v0_4_0.md",
    "docs/RELEASE_NOTES_v0_4_1.md",
    "docs/RELEASE_NOTES_v0_4_2.md",
    "docs/RELEASE_NOTES_v0_4_3.md",
    "docs/RELEASE_NOTES_v0_4_4.md",
    "docs/RELEASE_NOTES_v0_4_5.md",
    "docs/RELEASE_NOTES_v0_4_6.md",
    "docs/RELEASE_NOTES_v0_4_7.md",
    "docs/RELEASE_NOTES_v0_4_8.md",
    "docs/RELEASE_NOTES_v0_4_9.md",
    "docs/RELEASE_NOTES_v0_4_10.md",
    "docs/SCORING_SPEC.md",
    "docs/SUBMISSION_GUIDE.md",
    "docs/RELEASE_CHECKLIST.md"
  ],
  "project": "The Marked Bench",
  "schema": "marked_bench.benchmark-registry.v1",
  "schema_ids": {
    "adoption_packet": "marked_bench.adoption-packet.v1",
    "benchmark_report": "marked_bench.contradiction-benchmark-report.v2",
    "change_control": "marked_bench.change-control.v1",
    "conformance_report": "marked_bench.conformance-report.v1",
    "implementation_kit": "marked_bench.implementation-kit.v1",
    "leaderboard": "marked_bench.benchmark-leaderboard.v1",
    "leaderboard_submission": "marked_bench.leaderboard-submission.v1",
    "predictions": "marked_bench.contradiction-predictions.v2",
    "publication_packet": "marked_bench.publication-packet.v1",
    "result_card": "marked_bench.result-card.v1",
    "result_claim": "marked_bench.result-claim.v1",
    "scoring_compatibility": "marked_bench.scoring-compatibility.v1",
    "scoring_spec": "marked_bench.scoring-spec.v1",
    "standard_profile": "marked_bench.standard-profile.v1",
    "submission_bundle": "marked_bench.leaderboard-submission-bundle.v1",
    "submission_review": "marked_bench.submission-review.v1",
    "suite_manifest": "marked_bench.contradiction-suite-manifest.v1",
    "third_party_evidence_ledger": "marked_bench.third-party-evidence-ledger.v1"
  },
  "schemas": {
    "adoption_packet": "schemas/adoption_packet.schema.json",
    "benchmark_registry": "schemas/benchmark_registry.schema.json",
    "benchmark_report": "schemas/contradiction_benchmark_report.schema.json",
    "change_control": "schemas/change_control.schema.json",
    "conformance_report": "schemas/conformance_report.schema.json",
    "implementation_kit": "schemas/implementation_kit.schema.json",
    "leaderboard": "schemas/leaderboard.schema.json",
    "leaderboard_submission": "schemas/leaderboard_submission.schema.json",
    "predictions": "schemas/contradiction_predictions.schema.json",
    "publication_packet": "schemas/publication_packet.schema.json",
    "release_manifest": "schemas/release_manifest.schema.json",
    "result_card": "schemas/result_card.schema.json",
    "result_claim": "schemas/result_claim.schema.json",
    "scoring_compatibility": "schemas/scoring_compatibility.schema.json",
    "scoring_spec": "schemas/scoring_spec.schema.json",
    "standard_profile": "schemas/standard_profile.schema.json",
    "submission_bundle": "schemas/submission_bundle.schema.json",
    "submission_review": "schemas/submission_review.schema.json",
    "suite_manifest": "schemas/contradiction_suite_manifest.schema.json",
    "third_party_evidence_ledger": "schemas/third_party_evidence_ledger.schema.json"
  },
  "tracks": [
    {
      "baseline_reports": [
        "baselines/contradiction_engine_v0_1_1.json",
        "baselines/hash_prior_v0_1_1.json",
        "baselines/always_none_v0_1_1.json"
      ],
      "case_count": 23,
      "commands": {
        "build_leaderboard": "marked-bench --build-leaderboard REPORT... --leaderboard-output leaderboard/leaderboard_v0_1_1.json",
        "create_publication_packet": "marked-bench --create-publication-packet PACKET_DIR --publication-report REPORT --system-version VERSION --submitter SUBMITTER",
        "create_result_card": "marked-bench --create-result-card CARD --result-report REPORT --result-bundle BUNDLE",
        "create_result_claim": "marked-bench --create-result-claim PACKET_DIR/result_claim.json --claim-publication-packet PACKET_DIR/publication_packet.json",
        "create_submission": "marked-bench --create-submission submissions/foundation-system.json --submission-report artifacts/foundation-system-report.json --system-version VERSION --submitter SUBMITTER",
        "create_submission_bundle": "marked-bench --create-submission-bundle BUNDLE --bundle-submission SUBMISSION",
        "export_prediction_template": "marked-bench --suite contradiction --export-prediction-template artifacts/foundation-predictions.jsonl",
        "run_baseline": "marked-bench --suite contradiction --report artifacts/foundation-report.json",
        "score_predictions": "marked-bench --suite contradiction --score-predictions artifacts/foundation-predictions.jsonl --system-name SYSTEM --report artifacts/foundation-system-report.json",
        "validate_publication_packet": "marked-bench --validate-publication-packet PACKET_DIR/publication_packet.json",
        "validate_report": "marked-bench --validate-report REPORT",
        "validate_result_card": "marked-bench --validate-result-card CARD",
        "validate_result_claim": "marked-bench --validate-result-claim CLAIM",
        "validate_submission": "marked-bench --validate-submission SUBMISSION",
        "validate_submission_bundle": "marked-bench --validate-submission-bundle BUNDLE"
      },
      "labels": [
        "direct_negation",
        "property_mismatch",
        "definitional_violation",
        "universal_counterexample",
        "temporal_conflict",
        "none"
      ],
      "leaderboard": "leaderboard/leaderboard_v0_1_1.json",
      "name": "contradiction",
      "prediction_schema": "marked_bench.contradiction-predictions.v2",
      "profile": {
        "capability_counts": {
          "compact_unit_conflict": 1,
          "counterexample_detection": 1,
          "definition_check": 1,
          "definition_control": 1,
          "evidence_counterexample": 1,
          "evidence_elaboration_control": 1,
          "exception_sensitive_definition": 1,
          "explicit_counterexample": 1,
          "explicit_definition_denial": 1,
          "lexical_antonym": 1,
          "negation_scope": 1,
          "non_contradiction": 1,
          "numeric_control": 1,
          "numeric_property": 1,
          "policy_drift": 1,
          "predicate_negation": 1,
          "quantifier_control": 1,
          "review_mode_drift": 1,
          "review_status_antonym": 1,
          "semantic_paraphrase": 1,
          "temporal_control": 1,
          "temporal_scope": 1,
          "unit_consistency": 1
        },
        "case_count": 23,
        "contradiction_case_count": 16,
        "control_case_count": 7,
        "difficulty_counts": {
          "easy": 12,
          "medium": 11
        },
        "domain_counts": {
          "benchmarking": 2,
          "biology": 1,
          "geometry": 3,
          "governance": 5,
          "language": 1,
          "math": 1,
          "measurement": 3,
          "operations": 3,
          "safety": 3,
          "science": 1
        },
        "label_counts": {
          "definitional_violation": 3,
          "direct_negation": 4,
          "none": 7,
          "property_mismatch": 3,
          "temporal_conflict": 3,
          "universal_counterexample": 3
        },
        "quality_gates": {
          "min_cases": 15,
          "requires_all_contradiction_labels": true,
          "requires_control_cases": true,
          "requires_multiple_difficulties": true,
          "requires_multiple_domains": true
        },
        "tag_counts": {
          "adversarial": 1,
          "control": 7,
          "counterexample": 2,
          "definition": 4,
          "evidence": 1,
          "geometry": 2,
          "language": 1,
          "math": 1,
          "negation": 4,
          "numeric": 2,
          "paraphrase": 1,
          "policy": 2,
          "predicate": 1,
          "property": 3,
          "quantifier": 1,
          "scope": 2,
          "status": 1,
          "surface": 1,
          "temporal": 4,
          "unit": 2,
          "universal": 3,
          "v0.1.1": 6
        }
      },
      "report_schema": "marked_bench.contradiction-benchmark-report.v2",
      "status": "foundation",
      "suite_hash": "b47ffc31bef81c2643b6a405e4e511994ba59099eb6637470b6dc4c534aa6baf",
      "suite_id": "marked-bench-contradiction-standard",
      "suite_manifest": "suites/marked_bench_contradiction_standard_v0_1_1.json",
      "suite_version": "0.1.1",
      "title": "Foundation contradiction detection"
    },
    {
      "baseline_reports": [
        "baselines/contradiction_engine_adversarial_v0_2_0.json",
        "baselines/hash_prior_adversarial_v0_2_0.json",
        "baselines/always_none_adversarial_v0_2_0.json"
      ],
      "case_count": 17,
      "commands": {
        "build_leaderboard": "marked-bench --build-leaderboard REPORT... --leaderboard-output leaderboard/leaderboard_adversarial_v0_2_0.json",